{
  "schema_version": "1.0",
  "dataset_id": "cninfo_guizhou_moutai_2025_zh_10",
  "description": "Ten Chinese-language evidence-grounded questions for Guizhou Moutai's audited 2025 annual report. Includes numeric, table, audit-opinion, and insufficient-evidence coverage.",
  "metadata": {
    "company": "贵州茅台酒股份有限公司",
    "stock_code": "600519",
    "source_type": "cninfo",
    "source_url": "https://static.cninfo.com.cn/finalpage/2026-04-17/1225114741.PDF",
    "source_filename": "贵州茅台_2025年度报告_审计_2026-04-16.pdf",
    "source_sha256": "474905deeaf0f875fc0a1b097a626c0c7852c427faadc5d7fc7816cbf45ea288",
    "report_period": "FY2025",
    "audited": true,
    "audit_opinion": "标准无保留意见",
    "test_language": "zh-CN",
    "selection_frozen_before_answer_requests": true,
    "provider_calls_allowed": false,
    "notes": [
      "Amounts are RMB unless specified otherwise.",
      "PDF page numbers below refer to the printed report page number, not zero-based page indices.",
      "The audit-opinion case checks the report's explicit opinion label; it does not infer more than the auditor states.",
      "The unsupported market-share case must not be answered with an invented or externally sourced percentage."
    ]
  },
  "cases": [
    {
      "id": "MT-ZH-001",
      "language": "zh",
      "category": "single_company_numeric",
      "company": ["贵州茅台"],
      "question": "贵州茅台2025年度营业收入是多少？与2024年相比增长还是下降，幅度是多少？",
      "expected_answer": "2025年度营业收入为168,838,102,514.79元；2024年度为170,899,152,276.34元，同比下降1.21%。",
      "expected_sources": ["贵州茅台_2025年度报告_审计_2026-04-16.pdf"],
      "expected_retrieval_ids": ["report-page-6"],
      "expected_intent": "financial_fact",
      "expected_companies": ["贵州茅台"],
      "expected_use_retrieval": true,
      "reference_claims": [
        "2025营业收入=168838102514.79 RMB",
        "2024营业收入=170899152276.34 RMB",
        "同比=-1.21%"
      ],
      "criteria": ["数值、币种、年度与方向正确", "引用报告第6页"]
    },
    {
      "id": "MT-ZH-002",
      "language": "zh",
      "category": "single_company_numeric",
      "company": ["贵州茅台"],
      "question": "2025年归属于上市公司股东的净利润是多少？同比变化多少？",
      "expected_answer": "2025年归属于上市公司股东的净利润为82,320,067,101.68元，较2024年的86,228,146,421.62元下降4.53%。",
      "expected_sources": ["贵州茅台_2025年度报告_审计_2026-04-16.pdf"],
      "expected_retrieval_ids": ["report-page-6"],
      "expected_intent": "financial_fact",
      "expected_companies": ["贵州茅台"],
      "expected_use_retrieval": true,
      "reference_claims": ["归母净利润2025=82320067101.68 RMB", "归母净利润同比=-4.53%"],
      "criteria": ["不得与扣非归母净利润混淆", "引用报告第6页"]
    },
    {
      "id": "MT-ZH-003",
      "language": "zh",
      "category": "single_company_numeric",
      "company": ["贵州茅台"],
      "question": "贵州茅台2025年经营活动产生的现金流量净额是多少？较上年变化多少？",
      "expected_answer": "2025年经营活动产生的现金流量净额为61,522,204,989.35元，较2024年的92,463,692,168.43元下降33.46%。",
      "expected_sources": ["贵州茅台_2025年度报告_审计_2026-04-16.pdf"],
      "expected_retrieval_ids": ["report-page-6"],
      "expected_intent": "financial_fact",
      "expected_companies": ["贵州茅台"],
      "expected_use_retrieval": true,
      "reference_claims": ["经营现金流净额2025=61522204989.35 RMB", "同比=-33.46%"],
      "criteria": ["指标必须是经营活动现金流净额", "引用报告第6页"]
    },
    {
      "id": "MT-ZH-004",
      "language": "zh",
      "category": "financial_explanation",
      "company": ["贵州茅台"],
      "question": "年报将2025年经营活动现金流净额下降主要归因于什么？",
      "expected_answer": "年报说明，主要与控股子公司贵州茅台集团财务有限责任公司吸收集团成员单位存款减少，以及不可随时支取的同业存款增加有关。",
      "expected_sources": ["贵州茅台_2025年度报告_审计_2026-04-16.pdf"],
      "expected_retrieval_ids": ["report-page-6"],
      "expected_intent": "financial_analysis",
      "expected_companies": ["贵州茅台"],
      "expected_use_retrieval": true,
      "reference_claims": ["集团成员单位存款吸收减少", "不可随时支取的同业存款增加"],
      "criteria": ["按年报披露转述，不添加未披露的因果解释", "引用报告第6页"]
    },
    {
      "id": "MT-ZH-005",
      "language": "zh",
      "category": "table_product_comparison",
      "company": ["贵州茅台"],
      "question": "2025年茅台酒和其他系列酒各自实现多少收入？各自毛利率是多少？",
      "expected_answer": "茅台酒收入为146,499,906,480.49元，毛利率93.53%；其他系列酒收入为22,274,678,707.16元，毛利率76.11%。",
      "expected_sources": ["贵州茅台_2025年度报告_审计_2026-04-16.pdf"],
      "expected_retrieval_ids": ["report-page-10"],
      "expected_intent": "financial_comparison",
      "expected_companies": ["贵州茅台"],
      "expected_use_retrieval": true,
      "reference_claims": ["茅台酒收入=146499906480.49 RMB", "茅台酒毛利率=93.53%", "其他系列酒收入=22274678707.16 RMB", "其他系列酒毛利率=76.11%"],
      "criteria": ["两类产品标签和值必须一一对应", "引用报告第10页"]
    },
    {
      "id": "MT-ZH-006",
      "language": "zh",
      "category": "metric_disambiguation",
      "company": ["贵州茅台"],
      "question": "年报披露的酒类主营业务毛利率是多少？它是否等同于茅台酒产品毛利率？",
      "expected_answer": "酒类主营业务毛利率为91.23%；茅台酒产品毛利率为93.53%，两者口径不同，不能混为一项指标。",
      "expected_sources": ["贵州茅台_2025年度报告_审计_2026-04-16.pdf"],
      "expected_retrieval_ids": ["report-page-10"],
      "expected_intent": "financial_comparison",
      "expected_companies": ["贵州茅台"],
      "expected_use_retrieval": true,
      "reference_claims": ["酒类主营业务毛利率=91.23%", "茅台酒产品毛利率=93.53%", "指标口径不同"],
      "criteria": ["区分行业/主营业务汇总口径与产品口径", "引用报告第10页"]
    },
    {
      "id": "MT-ZH-007",
      "language": "zh",
      "category": "table_geography",
      "company": ["贵州茅台"],
      "question": "2025年贵州茅台国内和国外主营业务收入分别是多少？",
      "expected_answer": "国内主营业务收入为163,924,442,864.97元，国外为4,850,142,322.68元。",
      "expected_sources": ["贵州茅台_2025年度报告_审计_2026-04-16.pdf"],
      "expected_retrieval_ids": ["report-page-10"],
      "expected_intent": "financial_fact",
      "expected_companies": ["贵州茅台"],
      "expected_use_retrieval": true,
      "reference_claims": ["国内收入=163924442864.97 RMB", "国外收入=4850142322.68 RMB"],
      "criteria": ["不得将国内/国外与直销/批发口径混淆", "引用报告第10页"]
    },
    {
      "id": "MT-ZH-008",
      "language": "zh",
      "category": "table_sales_channel",
      "company": ["贵州茅台"],
      "question": "2025年直销和批发代理模式的收入分别是多少？各自同比如何变化？",
      "expected_answer": "直销收入为84,543,031,854.63元，同比增长12.96%；批发代理收入为84,231,553,333.02元，同比下降12.05%。",
      "expected_sources": ["贵州茅台_2025年度报告_审计_2026-04-16.pdf"],
      "expected_retrieval_ids": ["report-page-10"],
      "expected_intent": "financial_comparison",
      "expected_companies": ["贵州茅台"],
      "expected_use_retrieval": true,
      "reference_claims": ["直销收入=84543031854.63 RMB", "直销同比=12.96%", "批发代理收入=84231553333.02 RMB", "批发代理同比=-12.05%"],
      "criteria": ["渠道标签、金额和同比方向对应正确", "引用报告第10页"]
    },
    {
      "id": "MT-ZH-009",
      "language": "zh",
      "category": "audit_opinion",
      "company": ["贵州茅台"],
      "question": "贵州茅台2025年度财务报表由哪家会计师事务所审计？审计意见是什么？",
      "expected_answer": "审计机构为天健会计师事务所（特殊普通合伙）；年报披露的审计意见为标准无保留意见。",
      "expected_sources": ["贵州茅台_2025年度报告_审计_2026-04-16.pdf"],
      "expected_retrieval_ids": ["report-page-2", "report-page-53"],
      "expected_intent": "financial_fact",
      "expected_companies": ["贵州茅台"],
      "expected_use_retrieval": true,
      "reference_claims": ["审计机构=天健会计师事务所（特殊普通合伙）", "审计意见=标准无保留意见"],
      "criteria": ["不得把意见类型扩写为对未来经营或全部披露内容的保证", "引用年报第2页和审计报告第53页"]
    },
    {
      "id": "MT-ZH-010",
      "language": "zh",
      "category": "insufficient_evidence",
      "company": ["贵州茅台"],
      "question": "贵州茅台2025年在中国白酒行业的市场占有率是多少？如果这份年报没有披露，请明确说明无法从该报告确定。",
      "expected_answer": "这份2025年年度报告没有找到中国白酒行业市场占有率的披露，因此不能据此给出百分比；不能用收入数据自行推算市场占有率。",
      "expected_sources": ["贵州茅台_2025年度报告_审计_2026-04-16.pdf"],
      "expected_retrieval_ids": [],
      "expected_intent": "financial_fact_insufficient_evidence",
      "expected_companies": ["贵州茅台"],
      "expected_use_retrieval": true,
      "reference_claims": ["报告内未发现市场占有率披露", "不得捏造百分比或以不匹配分母推算"],
      "criteria": ["拒绝给出无来源市场份额数字", "说明知识范围仅为该份年报"]
    }
  ]
}
